{
  "schema": "openslack.notification_import_qualification_environment_manifest.v1",
  "status": "PENDING_EXTERNAL",
  "recorded_at": "2026-07-24T01:20:00+08:00",
  "gate": "G5-IMPORT-QUALIFICATION",
  "scope": "IB6_HISTORY_IMPORT_ONLY",
  "workflow": ".github/workflows/notification-import-qualification.yml",
  "timeout_minutes": 60,
  "repositories": [
    {
      "full_name": "Negentropy-Laby/openslack-notification-canary-a",
      "visibility": "private",
      "event_branch": "canary-events",
      "issues_required": true
    },
    {
      "full_name": "Negentropy-Laby/openslack-notification-canary-b",
      "visibility": "private",
      "event_branch": "canary-events",
      "issues_required": true
    }
  ],
  "environment": {
    "repository": "Negentropy-Laby/OpenSlack",
    "name": "notification-canary",
    "required_reviewer": "wsman",
    "deployment_branch": "main"
  },
  "fixed_variables": {
    "CANARY_REPO_A": "Negentropy-Laby/openslack-notification-canary-a",
    "CANARY_REPO_B": "Negentropy-Laby/openslack-notification-canary-b",
    "CANARY_VENDOR_SLACK": "openslack-slack",
    "CANARY_VENDOR_WEBHOOK": "openslack-webhook",
    "CANARY_ROUTE_SLACK": "slack-primary",
    "CANARY_ROUTE_WEBHOOK": "webhook-primary",
    "CANARY_ROUTING_EPOCH": "1"
  },
  "pending_variables": [
    "CANARY_GITHUB_APP_ID",
    "CANARY_GITHUB_APP_INSTALLATION_ID",
    "CANARY_QUALIFICATION_RUNNER",
    "CANARY_WORKSPACE_ROOT",
    "CANARY_EVIDENCE_ROOT",
    "CANARY_WATCH_CONFIG_PATH",
    "CANARY_VENDOR_EVIDENCE_DIR",
    "CANARY_HOST",
    "CANARY_HOST_USER",
    "CANARY_WEBHOOK_ORIGIN",
    "CANARY_IMAGE",
    "CANARY_SLACK_CHANNEL",
    "NOTIFICATION_SERVICE_ORIGIN",
    "NOTIFICATION_SERVICE_COMMIT",
    "NOTIFICATION_SERVICE_TREE",
    "NOTIFICATION_SERVICE_DEPLOYMENT_DIGEST"
  ],
  "required_secrets": ["CANARY_GITHUB_APP_PRIVATE_KEY", "HANDOFF_CALLER_KEY", "CANARY_AUDITOR_KEY"],
  "preflight": {
    "linux_host": "PENDING_EXTERNAL",
    "postgresql": "PENDING_EXTERNAL",
    "prometheus": "PENDING_EXTERNAL",
    "webhook_receiver": "PENDING_EXTERNAL",
    "slack_app_channel": "PENDING_EXTERNAL",
    "caller_auditor_scope": "PENDING_EXTERNAL",
    "two_vendors_active": "PENDING_EXTERNAL"
  },
  "does_not_claim": [
    "G5_CANARY_PASS",
    "LIVE_VERIFIED",
    "IB7_CUTOVER",
    "OPENSLACK_0_3_0",
    "PRODUCTION_READY"
  ]
}
